user_input,retrieved_contexts,response,reference,faithfulness,answer_relevancy,context_precision,context_recall
Qual é o custo total da contratação de 12 sentenciados junto à FUNAP?,"['EXTRATO DE CONTRATO DE PRESTAÇÃO DE SERVIÇOS Nº 01/2016, NOS TERMOS DO PADRÃO Nº 05/2002 Processo: 305.000.016/2016; Partes: ADMINISTRAÇÃO REGIONAL DO PARK WAY - RA XXIV e FUNDAÇÃO DE AMPARO AO TRABALHADOR PRESO - FUNAP; Fundamento Legal: Dispensa de Licitação com base no inciso XIII, do artigo 24, da Lei nº 8.666/93 e alterações; Objeto: Contratação de 12 sentenciados junto a FUNAP, Valor: o valor total do contrato é de R$ 286.696,80; Dotação Orçamentaria: U.O: 190126; Programa de Trabalho: 04.421.6211.2426.8494; Natureza de Despesa: 33.91.39; Fonte de Recurso: 120; Vigência: O Contrato terá vigência de 12 meses; Data de assinatura: 06 de Outubro de 2019; Signatários: Pela Administração regional do Park Way, ALINE GOMES DE FARIA e pela contratada FUNAP, DEUSELITA PEREIRA MARTINS.', 'EXTRATO DE TERMO ADITIVO Processo: 00367-00000013/2020-91. Contrato: Quarto Termo Aditivo ao Contrato nº 040519 - RA-FERC firmado entre o DISTRITO FEDERAL, por intermédio da ADMINISTRAÇÃO REGIONAL DA FERCAL e a FUNDAÇÃO DE AMPARO AO TRABALHADOR PRESO DO DISTRITO FEDERAL - FUNAP, doravante denominada Contratada, CNPJ nº 03.495.108/0001-90, em 16/03/2022. Objeto: a repactuação do valor referente a Bolsa Ressocialização dos sentenciados pertencentes ao NÍVEL I, NÍVEL II e NIVEL III, nos termos do Ofício nº 73/2022- FUNAP, conforme especificações técnicas apresentadas no processo 00367-00000013/2020-91. Valor total corrigido do contrato: R$', 'EXTRATO DO PRIMEIRO TERMO ADITIVO AO CONTRATO Nº 041897/2020 Processo: 00056-00001529/2020-57. PARTES: SECRETARIA DE ESTADO DE CIÊNCIA, TECNOLOGIA E INOVAÇÃO DO DISTRITO FEDERAL E FUNDAÇÃO DE AMPARO AO TRABALHADOR PRESO – FUNAP. OBJETO: Repactuar os valores das bolsas referente ao nível 1, conforme previsão no artigo 29, da Lei nº 7.210, de 11 de julho de 1984; o nível 2 equivalente a 20% (vinte por cento) em cima do valor do nível 1; e o nível 3 equivalente a 20% (vinte por cento) em cima do valor do nível 2; e prorrogar o prazo de vigência do contrato por 12 (doze) meses, a partir de 08/10/2021 a 08/10/2022, nos termos do art. 57, inciso II, da Lei nº 8.666, de 21 de junho de 1993, conforme solicitação contida no Ofício Nº 129/2021 - FUNAP/DIREX/DIRAFI/GEAD/NUCONV. ASSINATURA: 07/10/2021. VIGÊNCIA: 12 meses. SIGNATÁRIOS: Pelo DISTRITO FEDERAL: GILVAM MÁXIMO, Secretário de Estado de Ciência, Tecnologia e Inovação do Distrito Federal. Pela CONTRATADA: DEUSELITA PEREIRA MARTINS, na qualidade de Diretora Executiva.', 'EXTRATO DO CONTRATO DE PRESTAÇÃO DE SERVIÇOS Nº 20/2021 Partes: DETRAN-DF e a FUNDAÇÃO DE AMPARO AO TRABALHADOR PRESO DO DISTRITO FEDERAL/FUNAP. Processo 00055-00026808/2021-32. Objeto: Prestação de serviços de fornecimento de mão de obra, de até 40 (quarenta) reeducandos, a serem executados de forma contínua, relacionados às atividades previstas no Decreto nº 24.193/2003. Valor contratado: R$ 1.064.952,00 (um milhão, sessenta e quatro mil, novecentos e cinquenta e dois reais) anuais. Dotação Orçamentária: Nota de Empenho nº 2021NE01508, de 27/08/2021, Programa de Trabalho 06421621724268435, Fonte de Recurso 220, Evento 400091, Natureza da despesa: 339139, Modalidade: Estimativo, no valor de R$ 300.000,00 (trezentos mil reais). Vigência: 12 (doze) meses, prorrogáveis. Data da assinatura: 02/09/2021. Das partes: GUSTAVO CARVALHO AMARAL, Diretor Geral em exercício/DETRAN e DEUSELITA PEREIRA MARTINS, Diretora-Executiva/FUNAP.', 'CONTRATO Nº 03/2022 Contrato nº 03/2022 - TCB/FUNDAÇÃO DE AMPARO AO TRABALHADOR PRESO DO DISTRITO FEDERAL (FUNAP); CNPJ nº 03.495.108/0001-90; Processo nº 00095- 00000050/2022-44; Data de Assinatura: 22 de fevereiro de 2022; Modalidade: Dispensa de Licitação; Objeto: prestação de serviços a serem executados de forma contínua, correspondentes ao fornecimento de mão de obra de até 10 (dez) sentenciados presos e egressos; Valor anual: R$ 193.965,00 (cento e noventa e três mil novecentos e sessenta e cinco reais), Nota de Empenho: 2022NE00075, Data de Emissão: 18/02/2022, no valor de R$193.965,00 (cento e noventa e três mil novecentos e sessenta e cinco reais), Programa de Trabalho: 26122821623965313, Natureza de Despesa: 339139, Unidade Orçamentária: 26201, Fonte de Recurso: 220; Prazo de Vigência: 12 (doze) meses a contar da data de sua assinatura, podendo ser prorrogado por iguais e sucessivos períodos, até o limite de 60 (sessenta) meses; Assinantes: P/TCB Diretor-Presidente – JOÃO RAIMUNDO DE OLIVEIRA - Diretor Administrativo e Financeiro – MARCOS VINICIUS BOARON e P/FUNAP - DEUSELITA PEREIRA MARTINS - Representante Legal.']","R$ 286.696,00","R$ 286.696,80",1.0,0.47534673772585023,0.7499999999625,1.0
Quanto custa a contratação de doze indivíduos sentenciados através da FUNAP?,"['EXTRATO DO CONTRATO DE PRESTAÇÃO DE SERVIÇOS Nº 20/2021 Partes: DETRAN-DF e a FUNDAÇÃO DE AMPARO AO TRABALHADOR PRESO DO DISTRITO FEDERAL/FUNAP. Processo 00055-00026808/2021-32. Objeto: Prestação de serviços de fornecimento de mão de obra, de até 40 (quarenta) reeducandos, a serem executados de forma contínua, relacionados às atividades previstas no Decreto nº 24.193/2003. Valor contratado: R$ 1.064.952,00 (um milhão, sessenta e quatro mil, novecentos e cinquenta e dois reais) anuais. Dotação Orçamentária: Nota de Empenho nº 2021NE01508, de 27/08/2021, Programa de Trabalho 06421621724268435, Fonte de Recurso 220, Evento 400091, Natureza da despesa: 339139, Modalidade: Estimativo, no valor de R$ 300.000,00 (trezentos mil reais). Vigência: 12 (doze) meses, prorrogáveis. Data da assinatura: 02/09/2021. Das partes: GUSTAVO CARVALHO AMARAL, Diretor Geral em exercício/DETRAN e DEUSELITA PEREIRA MARTINS, Diretora-Executiva/FUNAP.', 'EXTRATO DE CONTRATO DE PRESTAÇÃO DE SERVIÇOS Nº 01/2016, NOS TERMOS DO PADRÃO Nº 05/2002 Processo: 305.000.016/2016; Partes: ADMINISTRAÇÃO REGIONAL DO PARK WAY - RA XXIV e FUNDAÇÃO DE AMPARO AO TRABALHADOR PRESO - FUNAP; Fundamento Legal: Dispensa de Licitação com base no inciso XIII, do artigo 24, da Lei nº 8.666/93 e alterações; Objeto: Contratação de 12 sentenciados junto a FUNAP, Valor: o valor total do contrato é de R$ 286.696,80; Dotação Orçamentaria: U.O: 190126; Programa de Trabalho: 04.421.6211.2426.8494; Natureza de Despesa: 33.91.39; Fonte de Recurso: 120; Vigência: O Contrato terá vigência de 12 meses; Data de assinatura: 06 de Outubro de 2019; Signatários: Pela Administração regional do Park Way, ALINE GOMES DE FARIA e pela contratada FUNAP, DEUSELITA PEREIRA MARTINS.', 'EXTRATO DO CONTRATO Nº 08/2021 Processo: 00056-00001194/2020-77. DAS PARTES: Fundação de Amparo ao Trabalhador Preso do Distrito Federal - FUNAP/DF e R DA S COSTA E MENDONCA COMERCIO DE TECIDOS LTDA. DO FUNDAMENTO LEGAL: Lei nº 8.666/1993, Lei Federal 10.520/2002, Decreto Federal nº 10.024/19 e Decreto Distrital 39.103/2018. DO OBJETO: aquisição de máquinas de costuras para as oficinas de capacitação e profissionalização da FUNAP/DF, conforme especificações contidas no “item 03” do Termo de Referência, consoante especifica o Edital nº 01/2021 (Doc. SEI/GDF nº 57517906), da Proposta de (Doc. SEI/GDF nº 59301569), que passam a integrar o Contrato, quantidade estimada, de acordo com a classificação por ela alcançada nos itens 02, 06, 07 e 13, do Pregão Eletrônico 01/2021. DO VALOR: R$ 17.880,00 (dezessete mil oitocentos e oitenta reais); DA DOTAÇÃO ORÇAMENTÁRIA: U.O: 44.201; Programa de Trabalho: 14.421.6217.2426.0015; Fonte de Recurso: 220; Natureza da Despesa: 44.90.52; Empenho nº 2021NE00794; DA VIGÊNCIA: 12 (doze) meses, a partir da assinatura; DATA DA ASSINATURA: 06/10/2021; SIGNATÁRIOS: Pela FUNAP/DF, DEUSELITA PEREIRA MARTINS, na qualidade de Diretora Executiva, e pela Contratada, RONEY MARCOS MILHOMEM MARTINS, na qualidade de Procurador.', 'EXTRATO DO CONTRATO Nº 09/2021 Processo: 00056-00001194/2020-77. DAS PARTES: Fundação de Amparo ao Trabalhador Preso do Distrito Federal - FUNAP/DF e L. F. SILVA MAQUINA EIRELI – EPP. DO FUNDAMENTO LEGAL: Lei nº 8.666/1993, Lei Federal 10.520/2002, Decreto Federal nº 10.024/19 e Decreto Distrital 39.103/2018. DO OBJETO: aquisição de máquinas de costuras para as oficinas de capacitação e profissionalização da FUNAP/DF, conforme especificações contidas no “item 03” do Termo de Referência, consoante especifica o Edital nº 01/2021 (Doc. SEI/GDF nº 57517906), da Proposta de (Doc. SEI/GDF nº 59301569), que passam a integrar o Contrato, na quantidade estimada, de acordo com a classificação por ela alcançada nos itens 04, 08, 09, 10 e 15, Pregão Eletrônico 01/2021. DO VALOR: R$ 30.896,00 (trinta mil oitocentos e noventa e seis reais); DA DOTAÇÃO ORÇAMENTÁRIA: U.O: 44.201; Programa de Trabalho: 14.421.6217.2426.0015; Fonte de Recurso: 220; Natureza da Despesa: 44.90.52; Empenho nº 2021NE00795; DA VIGÊNCIA: 12 (doze) meses, a partir da assinatura; DATA DA ASSINATURA: 07/10/2021; SIGNATÁRIOS: Pela FUNAP/DF, DEUSELITA PEREIRA MARTINS, na qualidade de Diretora Executiva, e pela Contratada, LETICIA CAMOLESI BAGÃO SILVA, na qualidade de Procuradora da empresa.', 'EXTRATO DO PRIMEIRO TERMO ADITIVO AO CONTRATO Nº 041897/2020 Processo: 00056-00001529/2020-57. PARTES: SECRETARIA DE ESTADO DE CIÊNCIA, TECNOLOGIA E INOVAÇÃO DO DISTRITO FEDERAL E FUNDAÇÃO DE AMPARO AO TRABALHADOR PRESO – FUNAP. OBJETO: Repactuar os valores das bolsas referente ao nível 1, conforme previsão no artigo 29, da Lei nº 7.210, de 11 de julho de 1984; o nível 2 equivalente a 20% (vinte por cento) em cima do valor do nível 1; e o nível 3 equivalente a 20% (vinte por cento) em cima do valor do nível 2; e prorrogar o prazo de vigência do contrato por 12 (doze) meses, a partir de 08/10/2021 a 08/10/2022, nos termos do art. 57, inciso II, da Lei nº 8.666, de 21 de junho de 1993, conforme solicitação contida no Ofício Nº 129/2021 - FUNAP/DIREX/DIRAFI/GEAD/NUCONV. ASSINATURA: 07/10/2021. VIGÊNCIA: 12 meses. SIGNATÁRIOS: Pelo DISTRITO FEDERAL: GILVAM MÁXIMO, Secretário de Estado de Ciência, Tecnologia e Inovação do Distrito Federal. Pela CONTRATADA: DEUSELITA PEREIRA MARTINS, na qualidade de Diretora Executiva.']","R$ 286.696,80","R$ 286.696,80",1.0,0.43867884869504953,0.4499999999775,1.0
Qual o valor desembolsado para a contratação de uma dúzia de sentenciados pela FUNAP?,"['EXTRATO DO CONTRATO DE PRESTAÇÃO DE SERVIÇOS Nº 20/2021 Partes: DETRAN-DF e a FUNDAÇÃO DE AMPARO AO TRABALHADOR PRESO DO DISTRITO FEDERAL/FUNAP. Processo 00055-00026808/2021-32. Objeto: Prestação de serviços de fornecimento de mão de obra, de até 40 (quarenta) reeducandos, a serem executados de forma contínua, relacionados às atividades previstas no Decreto nº 24.193/2003. Valor contratado: R$ 1.064.952,00 (um milhão, sessenta e quatro mil, novecentos e cinquenta e dois reais) anuais. Dotação Orçamentária: Nota de Empenho nº 2021NE01508, de 27/08/2021, Programa de Trabalho 06421621724268435, Fonte de Recurso 220, Evento 400091, Natureza da despesa: 339139, Modalidade: Estimativo, no valor de R$ 300.000,00 (trezentos mil reais). Vigência: 12 (doze) meses, prorrogáveis. Data da assinatura: 02/09/2021. Das partes: GUSTAVO CARVALHO AMARAL, Diretor Geral em exercício/DETRAN e DEUSELITA PEREIRA MARTINS, Diretora-Executiva/FUNAP.', 'EXTRATO DO CONTRATO Nº 09/2021 Processo: 00056-00001194/2020-77. DAS PARTES: Fundação de Amparo ao Trabalhador Preso do Distrito Federal - FUNAP/DF e L. F. SILVA MAQUINA EIRELI – EPP. DO FUNDAMENTO LEGAL: Lei nº 8.666/1993, Lei Federal 10.520/2002, Decreto Federal nº 10.024/19 e Decreto Distrital 39.103/2018. DO OBJETO: aquisição de máquinas de costuras para as oficinas de capacitação e profissionalização da FUNAP/DF, conforme especificações contidas no “item 03” do Termo de Referência, consoante especifica o Edital nº 01/2021 (Doc. SEI/GDF nº 57517906), da Proposta de (Doc. SEI/GDF nº 59301569), que passam a integrar o Contrato, na quantidade estimada, de acordo com a classificação por ela alcançada nos itens 04, 08, 09, 10 e 15, Pregão Eletrônico 01/2021. DO VALOR: R$ 30.896,00 (trinta mil oitocentos e noventa e seis reais); DA DOTAÇÃO ORÇAMENTÁRIA: U.O: 44.201; Programa de Trabalho: 14.421.6217.2426.0015; Fonte de Recurso: 220; Natureza da Despesa: 44.90.52; Empenho nº 2021NE00795; DA VIGÊNCIA: 12 (doze) meses, a partir da assinatura; DATA DA ASSINATURA: 07/10/2021; SIGNATÁRIOS: Pela FUNAP/DF, DEUSELITA PEREIRA MARTINS, na qualidade de Diretora Executiva, e pela Contratada, LETICIA CAMOLESI BAGÃO SILVA, na qualidade de Procuradora da empresa.', 'EXTRATO DE TERMO ADITIVO Processo: 00367-00000013/2020-91. Contrato: Quarto Termo Aditivo ao Contrato nº 040519 - RA-FERC firmado entre o DISTRITO FEDERAL, por intermédio da ADMINISTRAÇÃO REGIONAL DA FERCAL e a FUNDAÇÃO DE AMPARO AO TRABALHADOR PRESO DO DISTRITO FEDERAL - FUNAP, doravante denominada Contratada, CNPJ nº 03.495.108/0001-90, em 16/03/2022. Objeto: a repactuação do valor referente a Bolsa Ressocialização dos sentenciados pertencentes ao NÍVEL I, NÍVEL II e NIVEL III, nos termos do Ofício nº 73/2022- FUNAP, conforme especificações técnicas apresentadas no processo 00367-00000013/2020-91. Valor total corrigido do contrato: R$', 'EXTRATO DO CONTRATO Nº 08/2021 Processo: 00056-00001194/2020-77. DAS PARTES: Fundação de Amparo ao Trabalhador Preso do Distrito Federal - FUNAP/DF e R DA S COSTA E MENDONCA COMERCIO DE TECIDOS LTDA. DO FUNDAMENTO LEGAL: Lei nº 8.666/1993, Lei Federal 10.520/2002, Decreto Federal nº 10.024/19 e Decreto Distrital 39.103/2018. DO OBJETO: aquisição de máquinas de costuras para as oficinas de capacitação e profissionalização da FUNAP/DF, conforme especificações contidas no “item 03” do Termo de Referência, consoante especifica o Edital nº 01/2021 (Doc. SEI/GDF nº 57517906), da Proposta de (Doc. SEI/GDF nº 59301569), que passam a integrar o Contrato, quantidade estimada, de acordo com a classificação por ela alcançada nos itens 02, 06, 07 e 13, do Pregão Eletrônico 01/2021. DO VALOR: R$ 17.880,00 (dezessete mil oitocentos e oitenta reais); DA DOTAÇÃO ORÇAMENTÁRIA: U.O: 44.201; Programa de Trabalho: 14.421.6217.2426.0015; Fonte de Recurso: 220; Natureza da Despesa: 44.90.52; Empenho nº 2021NE00794; DA VIGÊNCIA: 12 (doze) meses, a partir da assinatura; DATA DA ASSINATURA: 06/10/2021; SIGNATÁRIOS: Pela FUNAP/DF, DEUSELITA PEREIRA MARTINS, na qualidade de Diretora Executiva, e pela Contratada, RONEY MARCOS MILHOMEM MARTINS, na qualidade de Procurador.', 'dezoito centavos), passando o contrato no valor de R$ 6.529.720,14 (seis milhões, quinhentos e vinte e nove mil seiscentos e trinta e três reais e trinta centavos) para R$ 7.011.165,32 (sete milhões, onze mil cento e sessenta e cinco reais e trinta e dois centavos), representando um aditamento acumulado de 11,10% do valor original. Fica prorrogado por mais 06 (seis) meses o PRAZO DE VIGÊNCIA do Contrato 013/2020, passando o prazo de 30/07/2021 para 30/01/2022. Fica prorrogado por mais 02 (dois) meses o PRAZO DE EXECUÇÃO do Contrato 013/2020, a contar da assinatura deste Termo Aditivo. Data da Assinatura: 28/07/2021. Signatários: Pela CODHAB/DF: WELLINGTON LUIZ DE SOUZA SILVA, na qualidade de Diretor Presidente; Pela Contratada: JOSÉ ELIAS FERNANDES JÚNIOR, na qualidade de Representante Legal. (Contrato nº 013/2020 publicado no DODF nº 82, em 04 de maio de 2020, página 74; Primeiro Termo Aditivo ao Contrato nº 013/2020 publicado no DODF nº 69, em 14 de abril de 2021, página 102)']","Não há informações suficientes para fornecer um valor exato relacionado à contratação de uma dúzia de sentenciados pela FUNAP nos textos dados. 

O que posso fornecer são as informações de pagamentos de:
- R$ 30.896,00 
- R$ 17.880,00 
- R$ 1.064.952,00 

E também, consta o valor de:  R$  7.011.165,32","R$ 286.696,80",0.16666666666666666,0.0,0.699999999965,1.0
"Qual é o orçamento destinado ao projeto ""BRB Stand Up Brasilia""?","['EXTRATO DE CONTRATO O BRB - Banco de Brasília S.A. torna pública a celebração do contrato de patrocínio junto a Souza Gomes Empreendimentos Culturais Ltda, projeto ""BRB Stand Up Brasília"", pelo valor global de R$40.000,00 (quarenta mil reais). Nota Executiva PRESI/SUMAR/GEPAR - 2019/054. Contrato: 169/2019. Assinatura: 27/9/2019. Vigência: 120 dias após a assinatura. Signatários pelo BRB: Karoline Vieira da Cunha. Pelo Contratado: André Luiz de Soua Gomes. Executor: Karoline Vieira da Cunha. Processo: 936/2019.', 'aberta no Banco de Brasília – BRB, correndo a despesa à conta de dotação orçamentária própria do Programa de Trabalho 13.392.6219.4091.0082 - Apoio a Projetos -Projetos Artísticos e Culturais-Distrito Federal – Fonte 100 - Natureza da despesa: 33.90.48; DA VIGÊNCIA: O presente termo de ajuste entrará em vigência a partir da data de assinatura do Agente Cultural, com duração de 2 (dois) anos, permitida a prorrogação na forma da lei vigente; DATA DA ASSINATURA: 17/03/2022; LEGISLAÇÃO: Lei nº 934/2017 e Decreto nº 38.933/2018; DO EXECUTOR: Comissão Permanente de Execução dos Projetos do FAC; Pelo FAC/SECEC/DF: João Roberto de Oliveira Moro, Subsecretário de Fomento e Incentivo Cultural; AGENTE CULTURAL: MARINALVA ALVES DE SOUSA.', 'de Brasília - BRB, correndo a despesa à conta de dotação orçamentária própria do Programa de Trabalho 13.392.6219.4091-0012 - Apoio a Projetos Artísticos e Culturais - Fonte 100 - Natureza da despesa: 33.90.48; DA VIGÊNCIA: O presente termo de ajuste entrará em vigência a partir da data de assinatura do beneficiário, com duração de 730 (setecentos e trinta) dias, permitida a prorrogação na forma da lei vigente; DATA DA ASSINAT U R A : 05/07/2018; LEGISLAÇÃO: Lei nº 267/1999 e Decreto nº 34.785/2013; DO EXECUTO R : Comissão Permanente de Execução dos Projetos do FAC; Pelo FAC/SEC/DF: Luís Gui- lherme Almeida Reis; BENEFICIARIO/A: JOSÉ VITAL SOBRINHO.', 'EXTRATO DE CONTRATO O BRB - Banco de Brasília S.A. torna pública a celebração do contrato de patrocínio junto a OH! ARTES, PUBLICIDADE, PRODUÇÃO E EVENTOS LTDA, , projeto ""Jota Quest Acústico em Brasília - 25 anos de sucessos"", pelo valor global de até R$ 70.000,00 (setenta mil reais). Projeto selecionado por intermédio do Programa BRB de Patrocínios Culturais 2019. Nota Executiva PRESI/SUMAR/GEPAR - 2019/027. Contrato: 2019/058. Assinatura: 17/05/2019. Vigência: 360 dias após a assinatura. Signatários pelo BRB: Wesley Cavalari Henriques. Pelo Contratado: João Felipe Oliveira Maione Alves. Executor: Wesley Cavalari Henriques. Processo: 330/2019.', 'EXTRATO DE CONTRATO O BRB – Banco de Brasília S.A. torna pública a celebração do contrato de patrocínio 2022/134, celebrado junto à Associação Brasileira de Instituições Financeiras de Desenvolvimento, para realização do projeto ""Fórum do Desenvolvimento da ABDE, sétima edição”, pelo valor global de R$ 80.000,00 (oitenta mil reais). Nota Executiva PRESI/SUMAR/GEPAT – 2022/15. Assinatura: 15/03/2022. Vigência: 30 dias. Signatários pelo BRB: PAULO HENRIQUE BEZERRA RODRIGUES COSTA e CRISTIANE MARIA LIMA BUKOWITZ. Pelo Contratado: Jeanette Halmenschlager Lontra e Valdecir José de Souza Tose. Executor: William Roberto Vaz de Oliveira. Processo 376/2022.']","R$ 40.000,00","R$ 40.000,00",1.0,0.4023316076534131,0.99999999995,1.0
"Quanto foi alocado para a realização do projeto ""BRB Stand Up Brasilia""?","['EXTRATO DE CONTRATO O BRB - Banco de Brasília S.A. torna pública a celebração do contrato de patrocínio junto a Souza Gomes Empreendimentos Culturais Ltda, projeto ""BRB Stand Up Brasília"", pelo valor global de R$40.000,00 (quarenta mil reais). Nota Executiva PRESI/SUMAR/GEPAR - 2019/054. Contrato: 169/2019. Assinatura: 27/9/2019. Vigência: 120 dias após a assinatura. Signatários pelo BRB: Karoline Vieira da Cunha. Pelo Contratado: André Luiz de Soua Gomes. Executor: Karoline Vieira da Cunha. Processo: 936/2019.', 'EXTRATO DE CONTRATO O BRB – Banco de Brasília S.A. torna pública a celebração do contrato de patrocínio 2022/147, celebrado junto à 3E Brasil Participações Eireli, para realização do projeto ""Piloto Enzo Elias – Porsche Cup Brasil – Temporada 2022”, pelo valor global de R$ 500.000,00 (quinhentos mil reais). Nota Executiva PRESI/SUMAR/GEPAT – 2022/016. Assinatura: 14/03/2022. Vigência: 270 dias. Signatários pelo BRB: Paulo Henrique Bezerra Rodrigues Costa e Cristiane Maria Lima Bukowitz. Pelo Contratado: Anuar José Elias Júnior. Executor: William Roberto Vaz de Oliveira. Processo:383/2022. POLLYANA OLIVEIRA, Superintendente SUMAR.', 'EXTRATO DE CONTRATO O BRB - Banco de Brasília S.A. torna pública a celebração do contrato de patrocínio junto a Karita Pereira da Silva 80481647104, projeto ""Debandando nas Feiras"", pelo valor global de até R$ 50.000,00 (cinquenta mil reais). Projeto selecionado por intermédio do Programa BRB de Patrocínios Culturais 2019. Nota Executiva PRESI/SUMAR/GEPAR - 2019/027. Contrato: 2019/029. Assinatura: 03/06/2019. Vigência: 360 dias após a assinatura. Signatários pelo BRB: Wesley Cavalari Henriques. Pelo Contratado Karita Pereira da Silva. Alves. Executor: Wesley Cavalari Henriques. Processo: 318/2019.', 'EXTRATO DE CONTRATO O BRB - Banco de Brasília S.A. torna pública a celebração do contrato de patrocínio junto a OH! ARTES, PUBLICIDADE, PRODUÇÃO E EVENTOS LTDA, , projeto ""Jota Quest Acústico em Brasília - 25 anos de sucessos"", pelo valor global de até R$ 70.000,00 (setenta mil reais). Projeto selecionado por intermédio do Programa BRB de Patrocínios Culturais 2019. Nota Executiva PRESI/SUMAR/GEPAR - 2019/027. Contrato: 2019/058. Assinatura: 17/05/2019. Vigência: 360 dias após a assinatura. Signatários pelo BRB: Wesley Cavalari Henriques. Pelo Contratado: João Felipe Oliveira Maione Alves. Executor: Wesley Cavalari Henriques. Processo: 330/2019.', 'aberta no Banco de Brasília – BRB, correndo a despesa à conta de dotação orçamentária própria do Programa de Trabalho 13.392.6219.4091.0082 - Apoio a Projetos -Projetos Artísticos e Culturais-Distrito Federal – Fonte 100 - Natureza da despesa: 33.90.48; DA VIGÊNCIA: O presente termo de ajuste entrará em vigência a partir da data de assinatura do Agente Cultural, com duração de 2 (dois) anos, permitida a prorrogação na forma da lei vigente; DATA DA ASSINATURA: 17/03/2022; LEGISLAÇÃO: Lei nº 934/2017 e Decreto nº 38.933/2018; DO EXECUTOR: Comissão Permanente de Execução dos Projetos do FAC; Pelo FAC/SECEC/DF: João Roberto de Oliveira Moro, Subsecretário de Fomento e Incentivo Cultural; AGENTE CULTURAL: MARINALVA ALVES DE SOUSA.']","R$ 40.000,00","R$ 40.000,00",1.0,0.39967794390900746,0.9999999999,1.0
"Qual o valor total investido no projeto ""BRB Stand Up Brasilia""?","['EXTRATO DE CONTRATO O BRB - Banco de Brasília S.A. torna pública a celebração do contrato de patrocínio junto a Souza Gomes Empreendimentos Culturais Ltda, projeto ""BRB Stand Up Brasília"", pelo valor global de R$40.000,00 (quarenta mil reais). Nota Executiva PRESI/SUMAR/GEPAR - 2019/054. Contrato: 169/2019. Assinatura: 27/9/2019. Vigência: 120 dias após a assinatura. Signatários pelo BRB: Karoline Vieira da Cunha. Pelo Contratado: André Luiz de Soua Gomes. Executor: Karoline Vieira da Cunha. Processo: 936/2019.', 'EXTRATO DE CONTRATO BRB 2019/040 Contratante: BRB - BANCO DE BRASÍLIA S.A. Contratada: PRICEWATERHOUSECOOPERS CONTADORES PÚBLICOS LTDA. Objeto: realização de investigação e auditoria forense sobre fatos ocorridos no BRB no período de janeiro de 2013 a janeiro de 2019. Vigência: 08/04/2019 a 05/10/2019. Valor: R$7.741.058,31 (sete milhões setecentos e quarenta e um mil e cinquenta e oito reais e trinta e um centavos). Signatários: pelo BRB, ANTONIO GIL PADILHA BERNARDES DA SILVEIRA, e pela Contratada, LEONARDO ANGELO LOPES. Executor: DOUGLAS SCHMEISCK RIBEIRO. Processo nº: 041.000.226/2019. As despesas decorrentes do presente Contrato correrão com base no Orçamento de Investimentos e Dispêndios, Natureza 4 - dispêndio das estatais e Fonte 1 - geração própria. Jean Felippe Mazépas. Gerente de Área.', 'EXTRATO DE CONTRATO A BRB - CRÉDITO, FINANCIAMENTO E INVESTIMENTO S.A. torna pública a celebração do contrato de patrocínio junto ao Instituto Alvorada Brasil, projeto ""52º Festival de Brasília do Cinema"", pelo valor global de R$100.000,00 (cem mil reais). Nota Executiva DIFAD/SUFAD/GERGE - 2019/127, Contrato: 2019/002. Assinatura: 04/11/2019. Vigência: 360 dias após a assinatura. Signatários pelo BRB: Carlos Antônio Vieira Fernandes. Pelo Contratado: Francisco José de Almeida. Processo: 1191/2019.', 'EXTRATO DO CONTRATO BRB Nº 154/2021 Contratante: BRB – BANCO DE BRASÍLIA S.A. Contratada: ANGEL’S SEGURANÇA E VIGILÂNCIA EIRELI. Modalidade: Pregão Eletrônico nº 29/2021. Objeto: Prestação de serviços de vigilância e segurança armada do patrimônio, empregados e usuários nas dependências do BRB, no desenvolvimento da atividade de vigilante, para os PA localizados na região sudeste, na cidade do Rio de Janeiro /RJ. Vigência: 05/07/2021 à 05/01/2024. Valor Total: R$ 459.460,89 (Quatrocentos e cinquenta e nove mil, quatrocentos e sessenta reais e oitenta e nove centavos). Gestor: Rafael Madruga Lopes. Signatário pelo BRB: Cristiane Maria Lima Bukowitz; e pela Contratada: José Mariano De Ávila Netto Guterres. Processo 041.000.098/2021. As despesas decorrentes do presente contrato correrão com base no orçamento de investimentos e dispêndios, natureza 4 - Dispêndio das Estatais e Fonte 1 - geração própria. Alex Rodrigues Seixas - Gerente de área e.e.', 'EXTRATO DE CONTRATO O BRB - Banco de Brasília S.A. torna pública a celebração do contrato de patrocínio junto a Karita Pereira da Silva 80481647104, projeto ""Debandando nas Feiras"", pelo valor global de até R$ 50.000,00 (cinquenta mil reais). Projeto selecionado por intermédio do Programa BRB de Patrocínios Culturais 2019. Nota Executiva PRESI/SUMAR/GEPAR - 2019/027. Contrato: 2019/029. Assinatura: 03/06/2019. Vigência: 360 dias após a assinatura. Signatários pelo BRB: Wesley Cavalari Henriques. Pelo Contratado Karita Pereira da Silva. Alves. Executor: Wesley Cavalari Henriques. Processo: 318/2019.']","R$ 40.000,00","R$ 40.000,00",1.0,0.4724766010750436,0.699999999965,0.5
"Qual é o orçamento total do projeto ""Gente que Inspira""?","['versões do Plano de Trabalho do projeto, a Comissão delibera que a instituição deverá alterar o total de', '(Autoria do Projeto: Comissão de Economia, Orçamento e Finanças)', '(Autoria do Projeto: Comissão de Economia, Orçamento e Finanças)', 'Do Objeto: Premiação em favor de MARTA LEONARDO DE OLIVEIRA, que teve o projeto intitulado MARTINHA DO COCO CONECTADA COM OS RITMOS DO MUNDO - SENEGAL, selecionado via edital de chamamento público nº 04/ 2021 - seleção de premiação de projetos aprovados pela Secretaria de Estado de Cultura e Economia Criativa do Distrito Federal, no âmbito do 61º ANIVERSÁRIO DE BRASÍLIA - FESTIVAL GIRA CULTURA DF. Prazo: 10 dias. Do Valor: R$ 2.000,00 (dois mil reais). Da Classificação Orçamentária: UO 16101; Gestão: 00001. Programa de Trabalho nº 13392621928030001, Fonte 100000000, Natureza de Despesa 339031, Modalidade: Ordinário. Data da Emissão da Nota de Empenho: 14 de junho de 2021.', 'instituição realize os ajustes. Diante do exposto, a Comissão delibera pela habilitação do projeto,']",Informação não disponível no contexto.,"R$ 120.000,00",1.0,0.0,0.0,0.5
"Quanto foi investido no projeto ""Gente que Inspira""?","['Objeto: Concessão de apoio financeiro para a realização do projeto ""PEGADA NORDESTIA"". Do Valor:', 'Objeto: Concessão de apoio financeiro para a realização do projeto ""SOBRE VIVER EM QUADRADOS"".', 'objeto a concessão de apoio financeiro pelo FUNDO DE APOIO À CULTURA ao Projeto', 'Do Objeto: Concessão de apoio financeiro para a realização do projeto ""A MAGIA DO CORDEL"". Do', 'Do Objeto: Concessão de apoio financeiro para a realização do projeto ""DE CAPA, MÁSCARA E']",Informação não disponível no contexto.,"R$ 120.000,00",0.0,0.0,0.0,0.0
"Qual é o valor total destinado ao projeto ""Gente que Inspira""?","['. PROPONENTE N° PROJETO P R O J E TO VALOR  APROVADO  NA ETAPA  DE ADMISSIBILIDADE', 'Objeto: Concessão de apoio financeiro para a realização do projeto ""PEGADA NORDESTIA"". Do Valor:', '. N° Projeto Proponente Valor Aprovado Nota do Projeto Classificado para etapa  de admissibilidade', '. N° Projeto Proponente Valor Aprovado Nota do Projeto Classificado para etapa  de admissibilidade', '. N° Projeto Proponente Valor Aprovado Nota do Projeto Classificado para etapa  de admissibilidade']",Informação não disponível no contexto.,"R$ 120.000,00",0.0,0.0,0.0,0.0
Qual é o custo total da compra de 74 pneus para motocicleta com dimensões 130/80R17?,"['EXTRATO DO CONTRATO Nº 70/20I9 Processo: 00054.00048974/2018-12. Partes: DF/PMDF X PARTS LUB DISTRIBUIDORA E SERVIÇOS EIRELI. Objeto: Aquisição de 74 Pneus para motocicleta dimensões 130/80R17. VALOR: R$ 13.570,86 (treze mil, quinhentos e setenta reais e oitenta e seis centavos). NOTA DE EMPENHO: 2019N8000827 de 06/11/2019. FONTE DE RECURSO: 0100000000. UG/UO: 170393/00001. PROGRAMA DE TRABALHO: 28845090300NR0053. NATUREZA DA DESPESA: 33.90.30. BASE LEGAL: Edital De Pregão Eletrônico n. 36/2018- PMDF. ASSINATURA: 08/l1/2019. VIGÊNCIA: 12 meses a contar da data de sua assinatura. SIGNATÁRIOS: Pelo DISTRITO FEDERAL: STÉFANO ENES LOBÃO, Chefe do Departamento de Logística e Finanças. pela Contratada: LEANDRO DE ABREU, na qualidade de Sócio.', '. 19 11 5 Unidade Pneu dimensões 165/70 R13. Descrição complementar conforme proposta apresentada pela empresa no termo de adjudicação nº 01/2019 (SRP) em consonância com o edital e seus anexos.\n\n. 21 20 Unidade Pneu Radial 90/90 R21 M/C 54 S- utilizado em motocicletas yamara XT 660 dianteiro. Descrição complementar conforme proposta apresentada pela empresa no termo de adjudicação nº 01/2019 (SRP) em consonância com o edital e seus anexos.', '. 10 20 Unidade Pneu Radial Moto 110/80 R19 M/C 59V Dianteiro. Descrição complementar conforme proposta apresentada pela empresa no termo de adjudicação nº 01/2019 (SRP) em consonância com o edital e seus anexos.\n\n. 13 420 Unidade Pneu  dimensões  265/70  ARO  16.  Descrição complementar conforme proposta apresentada pela empresa no termo de adjudicação nº 01/2019 (SRP) em consonância com o edital e seus anexos.', '. 11 20 Unidade Pneu 140/80 R17 M/C 69 BMW GS 650 Traseiro. Descrição complementar conforme proposta apresentada pela empresa no termo de adjudicação nº 01/2019 (SRP) em consonância com o edital e seus anexos.', '75.908.672,00 (setenta e cinco milhões, novecentos e oito mil, seiscentos e setenta e dois reais), para']","R$ 13.570,86","R$ 13.570,86",1.0,0.5770103381648817,0.9999999999,1.0
